"DESCRIPTION","DURATION IN MS","NAME","PARENT SUITE","START TIME","STATUS","STOP TIME","SUB SUITE","SUITE","TEST CLASS","TEST METHOD"
"","2416","Registration with existing email","","2026-05-02","passed","2026-05-02","","","",""
"","4624","Edit existing advertisement","","2026-05-02","passed","2026-05-02","","","",""
"","2065","Successful login with valid credentials","","2026-05-02","passed","2026-05-02","","","",""
"","9016","Create new advertisement","","2026-05-02","passed","2026-05-02","","","",""
"","1942","Successful registration with unique email","","2026-05-02","passed","2026-05-02","","","",""
